EXEMPLAR - COD.;titulo;autor;volume;EDIÇÃO;ANO;editora;COLEÇÃO;SÉRIE;ISBN;Nº EXEMPLAR;ASSUNTO;CLASSIFICAÇÃO;IDIOMA;OBSERVAÇÃO DO EXEMPLAR;;;;;;;;;;;;;;;;;;
E-100151;O discípulo radical;John Stott;;;2011;Ultimato;;;9,78858E+12;1;;VCE-S888;;;;;;;;;;;;;;;;;;;;
E-100152;O discípulo radical;John Stott;;;2011;Ultimato;;;9,78858E+12;2;;VCE-S888;;;;;;;;;;;;;;;;;;;;
E-100153;O que pode dar esperança: a luta pela sobrevivência e por uma vida com propósitos;Valter Junior;;;2015;Palavra;;;9,78856E+12;1;;AB-J95;;;;;;;;;;;;;;;;;;;;
E-100154;O que pode dar esperança: a luta pela sobrevivência e por uma vida com propósitos;Valter Junior;;;2015;Palavra;;;9,78856E+12;2;;AB-J95;;;;;;;;;;;;;;;;;;;;
E-100155;Caridade e seus frutos;Jonathan Edwards;;;2015;Fiel;;;9,78858E+12;1;"sermões; estudo bíblico";EB-E26;;;;;;;;;;;;;;;;;;;;
E-100156;A fé que agrada a Deus: mais que um mero acreditar;Sillas Campos;;;2015;Fiel;;;9,78851E+11;1;;AB-C198;;;;;;;;;;;;;;;;;;;;
E-100157;Autoestima: uma perspectiva bíblica;Jay E. Adams;;;2916 (reimpr.);ABCB;;;9,78856E+12;1;;AB-A211;;;;;;;;;;;;;;;;;;;;
E-100158;O pastor e o aconselhamento: um guia básico para pastoreio de membros em necessidade;"Jeremy Pierre; Deepak Reju";;;2015;Fiel;;;9,78858E+12;1;;AB-P622;;;;;;;;;;;;;;;;;;;;
E-100159;Lado a lado:como amar aqueles que estão sofrendo;David Furman;;;2017;Fiel;;;9,78858E+12;1;"aconselhamento; vida cristã";AB:VC-F986;;;;;;;;;;;;;;;;;;;;
E-100160;Como estudar a bíblia;John MacArthur;;;2016;Thomas Nelson Brasil;;;9,78858E+12;1;;VCE-M116;;;;;;;;;;;;;;;;;;;;
E-100161;Visão Federal;Alan Rennê;;;2017 (reimpr.);Os Puritanos;;;9,78856E+12;1;;VCF-R414;;;;;;;;;;;;;;;;;;;;
E-100162;Entendes o que lês;"Gordon D. Free; Douglas Stuart";;3. ed;2011;Vida Nova;;;9,78853E+11;1;;TBH-F853;;;;;;;;;;;;;;;;;;;;
E-100163;Socorro não tenho tempo;"Carolyn Mahaney; Nicole Whitacre; Kristin Chesemore; Janelle Bradshaw";;;2012;Monergismo;;;9,78856E+12;1;"Vida cristã; gestão do tempo; organização";VC-S678;;;;;;;;;;;;;;;;;;;;
E-100164;Socorro não tenho tempo;"Carolyn Mahaney; Nicole Whitacre; Kristin Chesemore; Janelle Bradshaw";;;2012;Monergismo;;;9,78856E+12;2;"Vida cristã; gestão do tempo; organização";VC-S678;;;;;;;;;;;;;;;;;;;;
E-100165;Deus é o evangelho;John Piper;;;2011 (reimpr.);Fiel;;;9,7886E+12;1;;VC-P665;;;;;;;;;;;;;;;;;;;;
E-100166;Uma introdução à espiritualidade cristã;Alister E. McGrath;;;2008;Vida;;;9,78854E+12;1;;VCE-M478;;;;;;;;;;;;;;;;;;;;
E-100167;Senhor, transforma minha atitude antes que seja tarde demais;James MacDonald;;;2015;Vida Nova;;;9,78853E+12;1;;AB-M135;;;;;;;;;;;;;;;;;;;;
E-100168;Brecha em nossa santidade;Kevin DeYoung;;;2013;Fiel;;;9,78858E+12;1;;AB-D529;;;;;;;;;;;;;;;;;;;;
E-100169;Lutando contra a incredulidade;John Piper;;;2014;Fiel;;;9,78858E+12;1;;AB-P665;;;;;;;;;;;;;;;;;;;;
E-100170;Fundamentos da teologia reformada;Hermisten Maia Pereira da Costa;;;2007;Mundo Cristão;;;9,78857E+12;1;;TS-C837;;;;;;;;;;;;;;;;;;;;
E-100171;Fé reformada;Sean Michael Lucas (et.al);vol.1;;2015;Cultura Cristã;;Fé reformada;9,78858E+12;1;;TS-F288;;;;;;;;;;;;;;;;;;;;
E-100172;Palavra que anima o coração;Rosther Guimarães Lopes;;;2012;sem editora;;;9,78854E+12;1;;AB-L864;;;;;;;;;;;;;;;;;;;;
E-100173;Pensamentos transformados, emoções redimidas;Ricardo Barbosa de Sousa;;;2016;Ultimato;;;9,78858E+12;1;"vida cristã; espiritualidade; aconselamento";VCE-S725;;;;;;;;;;;;;;;;;;;;
E-100174;A caminhada cristã na história: a bíblia, a igreja e a sociedade ontem e hoje;Alderi Souza de Matos;;;2005;Ultimato;;;8576539848;1;história da igreja;HI-M433;;;;;;;;;;;;;;;;;;;;
E-100175;Ministério de mulheres: amando e servindo a igreja por meio da palavra;Gloria Furman e Kathleen Nielson;;;2016;Fiel;;;9,78858E+12;1;;VCE-F986;;;;;;;;;;;;;;;;;;;;
E-100176;A reforma protestante: história, teologia e desafios;Ricardo Bitun (org.);;;2017;Hagnos;;;9,78858E+12;1;;IH-R332;;;;;;;;;;;;;;;;;;;;
E-100177;Calvinismo: as antigas doutrinas da graça;Paulo Anglada;;;2015;Knox publicações;;;9,78856E+12;1;;TS-A589;;;;;;;;;;;;;;;;;;;;
E-100178;Cristianimos puro e simples;C.S. Lewis;;3. ed.;2009;WMF Martins Fontes;;;9,78858E+12;1;;TS/A-L673;;;;;;;;;;;;;;;;;;;;
E-100179;Religião vida mansa: a teologia do prazer e o desafio para o crente num mundo materialista;J.I. Packer;;;1999;Cultura Cristã;;;;1;;VC-P119;;;;;;;;;;;;;;;;;;;;
E-100180;A certeza da fé;Herman Bavinck;;;2018;Monergismo;;;9,78857E+12;1;;AB-B354;;;;;;;;;;;;;;;;;;;;
E-100181;O ministério do pastor: prioridades bíblicas para pastores fiéis;Brian Croft;;;2020;Fiel;;;9,78866E+13;1;;L-C941;;;;;;;;;;;;;;;;;;;;
E-100182;A família do pastor: pastoreando sua família em meio aos desafios do ministério pastoral;"Brian Croft; Cara Croft";;;2021;Fiel;;;9,78656E+12;1;;VCF-C941;;;;;;;;;;;;;;;;;;;;
E-100183;Devocional para casais: reflexões para uma vida a dois;"Jaime Kemp; Judith Kemp";;;2002;Hagnos;;;8589320022;1;;VCF-K32;;;;;;;;;;;;;;;;;;;;
E-100184;O Deus do sexo: como a espiritualidade define a sua sexualidade;Peter Jones;;;2007;Cultura Cristã;;;8576221810;1;;AB-J76;;;;;;;;;;;;;;;;;;;;
E-100185;A grande comissão: o resgate da estratégia divina para o discipulado;Michael Horton;;;2014;Cultura Cristã;;;9,78858E+12;1;;MEI-H823;;;;;;;;;;;;;;;;;;;;
E-100186;O que você precisa saber sobre a batalha espiritual;Augustus Nicodemus;;5. ed.;2012;Cultura Cristã;;;9,78858E+12;1;;A-N633;;;;;;;;;;;;;;;;;;;;
E-100187;O que você precisa saber sobre a batalha espiritual;Augustus Nicodemus;;4. ed.;2006;Cultura Cristã;;;8576221586;2;;A-N633;;;;;;;;;;;;;;;;;;;;
E-100188;Resgatando a ambição;Dave Harvey;;;2012;Fiel;;;9,78858E+12;1;;VCE-H341;;;;;;;;;;;;;;;;;;;;
E-100189;Ouro tolo?: discernindo a verdade em uma época de erro;John MacArthur;;;2009 (reimpr.);Fiel;;;9,7886E+12;1;;VCE-M116;;;;;;;;;;;;;;;;;;;;
E-100190;Vencendo o mundo;Joel Beeke;;;2008;Fiel;;;9,7886E+12;1;;AB-B414;;;;;;;;;;;;;;;;;;;;
E-100191;Plares da fé: a atualidade da mensagem da reforma;Franklin Ferreira;;;2017;Vida Nova;;;9,78853E+12;1;;TS-F383;;;;;;;;;;;;;;;;;;;;
E-100192;Deus é soberano;A. W. Pink;;2. ed.;2015;Fiel;;;9,7886E+12;1;;TST-P655;;;;;;;;;;;;;;;;;;;;
E-100193;Deus falsos: as promessas vazias do dinheiro, sexo e poder, e a única esperança que realmente importa;Timothy Keller;;;2018;Vida Nova;;;9,78853E+12;1;;AB-K29;;;;;;;;;;;;;;;;;;;;
E-100194;Dialektos: métodos de aquisião e avaliação linguística ;Ronaldo Lidório;;;2008;;;;9,78858E+12;1;;MEI-L715;;;;;;;;;;;;;;;;;;;;
E-100195;Igreja: uma comunidade visionária;Ronaldo Lidório;;;;;;;;1;;MEI-L715;;;;;;;;;;;;;;;;;;;;
E-100196;Entendendo a disciplina na igreja;Jonathan Leeman;;;2019;Fiel;Entendendo a Igreja;;9,78858E+12;1;;TSEc-L485;;;;;;;;;;;;;;;;;;;;
E-100197;Entendendo a ceia do Senhor;Bobby Jamieson;;;2019;Fiel;Entendendo a Igreja;;9,78858E+12;1;;TSEc-J32;;;;;;;;;;;;;;;;;;;;
E-100198;Entendendo a autoridade da congregação;Jonathan Leeman;;;2019;Fiel;Entendendo a Igreja;;9,78858E+12;1;;TSEc-L485;;;;;;;;;;;;;;;;;;;;
E-100199;Entendendo o batismo;Bobby Jamieson;;;2019;Fiel;Entendendo a Igreja;;9,78858E+12;1;;TSEc-J32;;;;;;;;;;;;;;;;;;;;
E-100200;Entendendo a grande comissão;Mark Dever;;;2019;Fiel;Entendendo a Igreja;;9,78858E+12;1;;MEI-D491;;;;;;;;;;;;;;;;;;;;
E-100201;Entendendo a liderança da igreja;Mark Dever;;;2019;Fiel;Entendendo a Igreja;;9,75858E+12;1;;L-D491;;;;;;;;;;;;;;;;;;;;
E-100202;Inverso: diálogos indígenas  no alto do rio negro;Marcelo Carvalho;;;2011;;;;9,78859E+12;1;;MEI-C331;;;;;;;;;;;;;;;;;;;;
E-100203;Antropologia missionária;Ronaldo Lidório;;;2008;;;;9,78858E+12;1;"Missões; antropologia; intercultura";MEI-L715;;;;;;;;;;;;;;;;;;;;
E-100204;Introdução à antropologia missionária;Ronaldo Lidório;;;2011;Vida Nova;;;9,78853E+12;1;;MEI-L715;;;;;;;;;;;;;;;;;;;;
E-100205;Fundamentos da teologia prática;Julia Zabatiero;;;2006;Mundo Crista;;;8573254173;1;;VCE-Z12;;;;;;;;;;;;;;;;;;;;
E-100206;Abaixo a ansiedade: recursos bíblicos para vencermos um inimigo comum;John MacArthur;;2. ed.;2013;Cultura Cristã;;;9,78858E+12;1;;AB-M116;;;;;;;;;;;;;;;;;;;;
E-100207;Gotas de amor para a alma;Hernandes Dias Lopes;;;2015;Hagnos;;;9,78852E+12;1;;AB-L864;;;;;;;;;;;;;;;;;;;;
E-100208;Calvino, Genebra e a propagação da reforme na França so século XVI;Jean-Marc Berthoud;;;2017;Monergismo;;;9,78857E+12;1;;IH-B542;;;;;;;;;;;;;;;;;;;;
E-100209;Os cinco pontos do calvinismo;"Herman Hanko; Homer Hoeksema; Gise J. Van Baren";;;2013;Monergismo;;;9,78856E+12;1;;TSS-H241;;;;;;;;;;;;;;;;;;;;
E-100210;Eu sou mesmo cristão?;Mike McKinley;;;2013;Fiel;;;9,78858E+12;1;;AB-M478;;;;;;;;;;;;;;;;;;;;
E-100211;Faça alguma coisa: uma abordagem libertadora sobre a vontade de Deus em sua vida;Kevin DeYoung;;;2012;Mundo Cristão;;;9,78857E+12;1;;VCE-D529;;;;;;;;;;;;;;;;;;;;
E-100212;Cativo à Palavra: a vida de Martinho Lutero;Roland H. Bainton;;;2017;Vida Nova;;;9,78853E+12;1;;B-B162;;;;;;;;;;;;;;;;;;;;
E-100213;Depressão e graça: o cuidado de Deus diante do sofrimento de seus servos;Wilson Porte Jr.;;;2016;Fiel;;;9,78858E+12;1;;AB-P843;;;;;;;;;;;;;;;;;;;;
E-100214;Um chamado à reforma espiritual;D.A. Carson;;;2007;Cultura Cristã;;;8576221217;1;Oração;VCE-C321;;;;;;;;;;;;;;;;;;;;
E-100215;O aconselhamento bíblico depois de Jay Adams;Heath Lambert ;;;2018;Cultura Cristã;;;9,78858E+12;;;AB-L222;;;;;;;;;;;;;;;;;;;;
E-100216;Evangelo explícito;"Matt Chandler; Jared Wilson";;;2013;Fiel;;;9,78858E+12;1;;Ho-C455;;;;;;;;;;;;;;;;;;;;
E-100217;Teologia dos Reformadores;Timothy George;;;1993;Vida Nova;;;9,78853E+12;1;;HI-G347;;;;;;;;;;;;;;;;;;;;
E-100218;Palavras: o poder da comunicação na pregação do evangelho;"John Piper; Justin Taylor (org)";;;2012;Hagnos;;;9,78856E+12;1;"Comunicação; vida cristã; ";VCE-P154;;;;;;;;;;;;;;;;;;;;
E-100219;John Piper: ensaios em sua homenagem;"Sam Storms; Justin Taylor (org.)";;;2013;Hagnos;;;9,78858E+12;1;"Vida cristã; ética cristã; hedonismo; sofrimento; soberania de Deus; ";B-J65;;;;;;;;;;;;;;;;;;;;
E-100220;O Evangelho para a vida real: voltando-se para o poder libertador da cruz dia após dia;Jerry Bridges;;;2015;Fiel;;;9,78858E+12;;;VCE-B852;;;;;;;;;;;;;;;;;;;;
E-100221;Principles of Biblical interpretation;Louis Berkhof;;;1994;Baker Book House;;;801064775;;;TBH-B512;;;;;;;;;;;;;;;;;;;;
E-100222;O Evangelho no trabalho: servindo Cristo em sua profissão com um novo propósito;"Sebastian Traeger; Greg Gilbert";;;2014;Fiel;;;9,78858E+12;1;;VCE-T764;;;;;;;;;;;;;;;;;;;;
E-100223;Real Marriage: the truth about sex, friendship and life together;"Mark Driscoll; Grace Driscoll";;;2012;Thomas Nelson;;;9,7814E+12;;;VCF-D781;;;;;;;;;;;;;;;;;;;;
E-100224;;;;;;;;;;;;;;;;;;;;;;;;;;;;;;;;
E-100225;A walk through the Bible;Lesslie Newbigin;;;1999;Westminster John Knox Press;;;6642222293;1;;TB-N534;;;;;;;;;;;;;;;;;;;;
E-100226;Recomendações aos jovens teólogos e pastores;Helmut Thielicke;;;2014;Vida Nova;;;9,78853E+12;1;;AB-T431;;;;;;;;;;;;;;;;;;;;
E-100227;A verdadeira obra do Espírito: sinais de autenticidade;Jonathan Edwards;;2. ed.;2010;Vida Nova;;;9,78853E+12;1;;VCE-E26;;;;;;;;;;;;;;;;;;;;
E-100228;Medita estas coisas: conselhos para uma conversão segura;Richard Baxter;;2.ed;2008;Knox Publicações;;;9,78856E+12;1;"discipulado básico; conversão; vida cristã";DiB-B355;;;;;;;;;;;;;;;;;;;;
E-100229;Pensar, amar e fazer;John Piper;;;2013;Cultura Cristã;;;9,78858E+12;1;"cristianismo integral; vida cristã";VCE-P665;;;;;;;;;;;;;;;;;;;;
E-100230;Crer é também pensar;John Stott;;;2012;ABU Editora;;;9,78858E+12;1;"fé e razão; vida cristã";VCE-S888;;;;;;;;;;;;;;;;;;;;
E-100231;Eu sou chamado?: a vocação para o ministério pastoral;Dave Harvey;;;2013;Fiel;;;9,78858E+12;1;;L-H341;;;;;;;;;;;;;;;;;;;;
E-100232;Firmes na fé: conselhos para crentes fracos;Richard Baxter;;;2009;Knox;;;9,78856E+12;1;;AB-B355;;;;;;;;;;;;;;;;;;;;
E-100233;Gênesis no espaço-tempo;Francis A. Schaeffer;;;2014;Monergismo;;;9,78856E+12;1;;A-S294;;;;;;;;;;;;;;;;;;;;
E-100234;Coronavírus e Cristo;John Piper;;;2020;Fiel;;;9,78656E+12;1;;VC-P665;;;;;;;;;;;;;;;;;;;;
E-100235;Quebrantamento: espírito de humilhação;Richard Baxter;;3. ed.;2008;Knox;;;9,78856E+12;1;;AB-B355;;;;;;;;;;;;;;;;;;;;
E-100236;Todo mundo pensa, você também: aprendendo a pensar biblicamente;Wadislau Martins Gomes;;;2013;Monergismo;;;9,78856E+12;1;;VCE-G633;;;;;;;;;;;;;;;;;;;;
E-100237;Tomando decisões segunda a vontade de Deus;Herber Carlos de Campos Jr.;;;2013;Fiel;;;9,78858E+12;1;;VCE-C198;;;;;;;;;;;;;;;;;;;;
E-100238;Deus, revelação e autoridade: o Deus que fala e age;Carl F.H. Henry;;;2016;Hagnos;;;9,78858E+12;1;;TS-H521;;;;;;;;;;;;;;;;;;;;
E-100239;O Deus presente: encontrando seu lugar no plano de Deus;D.A. Carson;;;2012;Fiel;;;9,78858E+12;1;;VC-C321;;;;;;;;;;;;;;;;;;;;
E-100240;Confissões: livros I-VIII;Agostinho;1;;2020;Petra;;;9,78858E+12;1;"Biografia; Santo Agostinho";B-A275;;;;;;;;;;;;;;;;;;;;
E-100241;Confissões: livros IX-XIII;Agostinho;2;;2020;Petra;;;9,78858E+12;1;"Biografia; Santo Agostinho";B-A275;;;;;;;;;;;;;;;;;;;;
E-100242;Raízes da cultura ocidental;Herman Dooyeweerd;;;2015;Cultura cristã;;;9,78858E+12;1;"Apologética; cormovisão cristã; história do cristianismo";A-D691;;;;;;;;;;;;;;;;;;;;
E-100243;Simplesmente crente: por uma vida cristã comum;Michael Scott Horton;;;2016;Fiel;;;9,87858E+12;1;Vida cristã;VCE-H823;;;;;;;;;;;;;;;;;;;;
E-100244;Irmãos: cúmplices e rivais em aliança;Elizabeth Stowell Charles Gomes;;;2008;Cultura cristã;;;9,78858E+12;1;"Vida cristã; família; ";VCF-G633;;;;;;;;;;;;;;;;;;;;
E-100245;Revitalização e crescimento: uma nova vida para você e sua igreja;Gildásio J. B. dos Reis;;;2012;;;;9,78859E+12;1;Igreja;MEI-R375;;;;;;;;;;;;;;;;;;;;
E-100246;As dimensões da espiritualidade reformada: Martyn Lloyd-Jones e o resgate da tradição calvinista de vida cristã;Antônio Carlos Costa;;;2005;"Pontal do Atalaia; Textus";;;;1;"Vida cristã; espiritualidade; biografia";B-C837;;;;;;;;;;;;;;;;;;;;
E-100247;A gide to expository ministry;Dan Dumas (ed.);3;;2012;SBTS Press;;;9,78062E+12;1;"Pregação expositiva; homilética";Ho-G453;;;;;;;;;;;;;;;;;;;;
E-100248;Levando Deus a sério;Kevin DeYoung;;;2014;Fiel;;;9,78858E+12;1;"Bibliologia; Autoridade, Inspiração";VCE-D529;;;;;;;;;;;;;;;;;;;;
E-100249;Doutrina e devoção;Rodrigo Bibo;;;2020;Charpentier;;;9,7866E+12;1;"Espiritualidade; vida cristã; piedade; teologia";VCE-B582;;;;;;;;;;;;;;;;;;;;
E-100250;Oração: o exercício contínuo da fé;João Calvino;;;2016;Vida;;;9,87854E+12;1;"Vida cristã; devocional; oração; devoção";VCE-C168;;;;;;;;;;;;;;;;;;;;
E-100251;Oração: o exercício contínuo da fé;João Calvino;;;2016;Vida;;;9,87854E+12;2;"Vida cristã; devocional; oração; devoção";VCE-C168;;;;;;;;;;;;;;;;;;;;
E-100252;Vestígios da Trindade: sinais de Deus na criação e na experiência humana;Peter J. Leithart;;;2018;Monergismo;;;9,78857E+12;1;"Vida cristã; cosmovisão trinitária";VCE-L533;;;;;;;;;;;;;;;;;;;;
E-100253;O mundo, a carne e o diabo;Russell P. Shedd;;2. ed. 1995;2006 (reimpr);Vida Nova;;;8527500310;1;"Vida cristã; ";VCE-S541;;;;;;;;;;;;;;;;;;;;
E-100254;Como viver e agradar a Deus;R. C. Sproul;;2.ed;2006;Cultura cristã;;;8576221519;1;"Vida cristã; santificação";VCE-S771;;;;;;;;;;;;;;;;;;;;
E-100255;Salvo de que? : compreendendo o significado da salvação;R. C. Sproul;;;2006;Vida;;;8573677945;1;"Teologia dogmática: salvação; soteriologia; ";TSS-S771;;;;;;;;;;;;;;;;;;;;
E-100256;O que todo presbiteriano inteligente deve saber;"Adão Carlos Nascimento; Alderi Souza de Matos";;;2007;SOCEP Editora;;;9,7886E+12;1;"Presbiterianismo; calvinismo; Igreja Presbiteriana; história";IP-N244;;;;;;;;;;;;;;;;;;;;
E-100257;O segredo do contentamento;William B. Barcley;;1.ed. 2014;2018 (reimpr);Nutra;;;9,78856E+12;1;"Vida cristã; contentamento";VCE-B244;;;;;;;;;;;;;;;;;;;;
E-100258;Nascido escravo;Martinho Lutero;;2.ed. 2007;2015 (reimpr);Fiel;;;9,7886E+12;1;"livre-arbítrio; doutrina reformada";TSS-L973;;;;;;;;;;;;;;;;;;;;
E-100259;Graça abundante ao principal dos pecadores: uma autobiografia de John Bunyan;John Bunyan;;1.ed. 2012;2015 (reimpr);Fiel;;;9,78858E+12;1;"Biografia; John Bunyan";B-B942;;;;;;;;;;;;;;;;;;;;
E-100260;Pregue: quando a teologia encontra-se com a prática;"Mark Dever; Greg Gilbert";;;2016;Fiel;;;9,78858E+12;1;"Pregação expositiva; homilética";Ho-D491;;;;;;;;;;;;;;;;;;;;
E-100261;A abolição do homem;C. S. Lewis;;;2017;Thomas Nelson;;;9,78858E+12;1;"Filosofia; cristianismo; valores; moralidade; ";FC-L673;;;;;;;;;;;;;;;;;;;;
E-100262;Política segundo a bíblia: princípios que todo cristão deve conhecer;Wayne Grudem;;;2014;Vida Nova;;;9,78853E+12;1;"Política; vida cristã";VC-G885;;;;;;;;;;;;;;;;;;;;
E-100263;Pregação bíblica: o desenvolvimento e a entrega de sermões expositivos;Haddon W. Robinson;;1.ed. 2002;2005 (reimpr.);Shedd Publicações;;;8588315173;1;"Pregação expositiva; homilética";Ho-R658;;;;;;;;;;;;;;;;;;;;
E-100264;As firmes resoluções de Jonathan Edwards: um perfil de homens piedosos;Steven J. Lawson;;1. ed. 2010;2014 (reimpr.);Fiel;;;9,7886E+12;1;"Vida cristã; santificação; biografia; Jonathan Edwards";VCE-L425;;;;;;;;;;;;;;;;;;;;
E-100265;Finalmente vivos: o que acontece quando nascemos de novo?;John Piper;;;2011;Fiel;;;9,7886E+12;1;"Conversão; novo nascimento; regeneração; salvação";TSS-P665;;;;;;;;;;;;;;;;;;;;
E-100266;Oração e a vida cristã;"John Knox; João Calvino";;1.ed. 2016;2017 (reimpr.);Vida;;;9,78854E+12;1;"Oração; Vida crista";VCE-K74;;;;;;;;;;;;;;;;;;;;
E-100267;O breve catecismo de Westminster;Assembleia de Westinster;;3.ed;2013;Cultura cristã;;;9,87858E+12;1;"Confissão de fé; símbolo de fé";SF-B846;;;;;;;;;;;;;;;;;;;;
E-100268;Pense biblicamente: recuperando a visão cristã de mundo;John Macarthur;;1.ed 2005;2013 (reimpr.);Hagnos;;;8589320715;1;"masculinidade; feminilidade; adoração; aconselhamento bíblico; ciência; economia; educação cristã; igrea e estado; cultura;arte; vida cristã; apologética";VC:A-M116;;;;;;;;;;;;;;;;;;;;
E-100269;Teologia da alegria: a plenitude da satisfação em Deus;John Piper;;1.ed. 2001;2003 (reimpr.);Shedd Publicações;;;8588315076;1;"Contentamento; vida cristã; hedonismo cristão";VCE-P665;;;;;;;;;;;;;;;;;;;;
E-100270;Mensagem para hoje;Martyn Lloyd-Jones;;2. ed;1998;Publicações Evangélicas Selecionadas;;;;1;Devocional;VCE-L793;;;;;;;;;;;;;;;;;;;;
E-100271;;;;;;;;;;;;;;;;;;;;;;;;;;;;;;;;
E-100272;Dinheiro, sexo e poder: um chamado à renovação ética;Richard J. Foster;;2.ed;2005;Mundo Cristão;;;8585670959;1;"vida cristã; ética cristã; ";VCF-F754;;;;;;;;;;;;;;;;;;;;
E-100273;Caridade e seus frutos: um estudo sobre o amor em Coríntios 13;Jonathan Edwards;;;2015;Fiel;;;9,78858E+12;1;"sermões; caridade; amor";VC-E26;;;;;;;;;;;;;;;;;;;;
E-100274;Prática de aconselhamento redentivo;Wadislau Martins Gomes;;;2014;"Monergismo; Refúgio";;;9,78856E+12;1;aconselhamento bíblico;AB-G633;;;;;;;;;;;;;;;;;;;;
E-100275;Morrer de tanto viver;Nathan D Wilson;;;2018;Monergismo;;;9,78857E+12;1;"vida cristã; cosmovisão";VCE-W746;;;;;;;;;;;;;;;;;;;;
E-100276;A confissão de fé de Westminster;Assembleia de Westinster;;17.ed.;reimpr. 2008;Cultura cristã;;;9,78858E+12;1;"símbolos de fé; confissão de fé";SF-C748;;;;;;;;;;;;;;;;;;;;
E-100277;Ministérios de misericórdia: o chamado para a estrada de Jericó;Timothy Keller;;;2016;Vida Nova;;;9,78853E+12;1;"igreja; problemas sociais; missões";MEI-K29;;;;;;;;;;;;;;;;;;;;
E-100278;A questão indígena: uma luta desigual: missões, manipulação e sacerdócio acadêmico;"Isaac Costa de Souza; Ronaldo Lidório (org.)";;;2008;Ultimato;;;9,78858E+12;1;"tribos indígenas; missões; animismo; evangelização";MEI-Q5;;;;;;;;;;;;;;;;;;;;
E-100279;O credo apostólico: as doutrinas centrais da fé;Franklin Ferreira;;;2015;Fiel;;;9,78858E+12;1;símbolo de fé;SI-F383;;;;;;;;;;;;;;;;;;;;
E-100280;40 questões para se interpretar a Bíblia;Robert L. Plummer;;;2017;Fiel;;;9,78858E+12;1;"interpretação bíblica; hermeneutica";HE;;;;;;;;;;;;;;;;;;;;
E-100281;O Antigo Testamento: entenda sua mensagem;Alec Motyer;;;2010;Shedd Publicações;;;9,78858E+12;1;estudo bíblico;EB-M922;;;;;;;;;;;;;;;;;;;;
E-100282;Uma perspectiva cristã sobre a homossexualidade;Valdeci da Silva Santos;;;2006;Cultura cristã;;;8576221381;1;"hossexualidade; ética cristã; vida cristã";VC:A-S237;;;;;;;;;;;;;;;;;;;;
E-100283;A busca da santidade;Jerry Bridges;;;2013;Monergismo;;;9,78856E+12;1;"sanntidade; vida cristã";VCE-B852;;;;;;;;;;;;;;;;;;;;
E-100284;O Conceito de teologia e pedagogia na Didática magna de Comenius;Edson Pereira Lopes;;;2003;Editora Mackenzie;Descoberta, 1;;8587739514;1;"educação cristã; pedagogia cristã; ";EC-L864;;;;;;;;;;;;;;;;;;;;
E-100285;Ajudando uns aos outros pelo aconselhamento;Gary R. Collins;;;2005;Vida Nova;;;8527503301;1;"aconselhamento; comportamento";AB-C712;;;;;;;;;;;;;;;;;;;;
E-100286;Reforma agora: o antídoto para a confusão evangélica no Brasil;Renato Vargens;;1.ed. 2013;2016 (reimpr.);Fiel;;;9,78858E+12;1;"solas da reforma; igreja; erros eclesiásticos";I-V297;;;;;;;;;;;;;;;;;;;;
E-100287;Martinho Lutero: uma coletânea de escritos;Martinho Lutero;;;2017;Vida Nova;Clássicos da Reforma;;9,78853E+12;1;"estudos; reforma protestante; teologia";T:HI-L973;;;;;;;;;;;;;;;;;;;;
E-100288;Futebol é bom para cristão: vestindo a camisa em honra a Deus;Emílio Garofalo Neto;;;2018;Monergismo;;;9,78857E+12;1;" futebol; espiritualidade; vida cristã";VCE-G237;;;;;;;;;;;;;;;;;;;;
E-100289;As Crônicas de Aedyn: os escolhidos;Alister MacGrath;;;2011;Hagnos;;As Crônicas de Aedyn, 1;9,78852E+12;1;"ficção cristã; literatura infanto-juvenil";LIJ-M147;;;;;;;;;;;;;;;;;;;;
E-100290;As Crônicas de Aedyn: o voo dos exilados;Alister MacGrath;;;2012;Hagnos;;As Crônicas de Aedyn, 2;9,78852E+12;1;"ficção cristã; literatura infanto-juvenil";LIJ-M147;;;;;;;;;;;;;;;;;;;;
E-100291;As Crônicas de Aedyn: o desvanecer das trevas;Alister MacGrath;;;2014;Hagnos;;As Crônicas de Aedyn, 3;9,78852E+12;1;"ficção cristã; literatura infanto-juvenil";LIJ-M147;;;;;;;;;;;;;;;;;;;;
E-100292;A Sociedade do Anel;J. R. R. Tolkien;1;;2019;Harper Collins;;O Senhor dos Anéis;9,7886E+12;1;"ficção cristã; literatura";LFC-T649;;;;;;;;;;;;;;;;;;;;
E-100293;As duas torres;J. R. R. Tolkien;2;;2019;Harper Collins;;O Senhor dos Anéis;9,7886E+12;1;"ficção cristã; literatura";LFC-T649;;;;;;;;;;;;;;;;;;;;
E-100294;O retorno do rei;J. R. R. Tolkien;3;;2019;Harper Collins;;O Senhor dos Anéis;9,7886E+12;1;"ficção cristã; literatura";LFC-T649;;;;;;;;;;;;;;;;;;;;
E-100295;O Silmarillion;J. R. R. Tolkien;;;2011;Martins Fontes;;;9,78858E+12;1;"ficção cristã; literatura";LFC-T649;;;;;;;;;;;;;;;;;;;;
E-100296;O sobrino do mago;C. S. Lewis;1;4.ed.;2014;Martins Fontes;;Crônicas de Nárnia;9,78858E+12;1;"ficção cristã; literatura infanto-juvenil";LIJ-L673;;;;;;;;;;;;;;;;;;;;
E-100297;O Leão, a Feiticeira e o guarda-roupa;C. S. Lewis;2;2.ed.;2003;Martins Fontes;;Crônicas de Nárnia;8533616155;1;"ficção cristã; literatura infanto-juvenil";LIJ-L673;;;;;;;;;;;;;;;;;;;;
E-100298;O cavalo e seu menino;C. S. Lewis;3;3.ed.;2011;Martins Fontes;;Crônicas de Nárnia;9,78858E+12;1;"ficção cristã; literatura infanto-juvenil";LIJ-L673;;;;;;;;;;;;;;;;;;;;
E-100299;Príncipe Caspian;C. S. Lewis;4;5.ed.;2017;Martins Fontes;;Crônicas de Nárnia;9,78855E+12;1;"ficção cristã; literatura infanto-juvenil";LIJ-L673;;;;;;;;;;;;;;;;;;;;
E-100300;A viagem do Peregrino da Álvorada;C. S. Lewis;5;2.ed.;2003;Martins Fontes;;Crônicas de Nárnia;853361618X;1;"ficção cristã; literatura infanto-juvenil";LIJ-L673;;;;;;;;;;;;;;;;;;;;
E-100301;A cadeira de prata;C. S. Lewis;6;3.ed.;2014;Martins Fontes;;Crônicas de Nárnia;9,78858E+12;1;"ficção cristã; literatura infanto-juvenil";LIJ-L673;;;;;;;;;;;;;;;;;;;;
E-100302;A última batalha;C. S. Lewis;7;3.ed.;2014;Martins Fontes;;Crônicas de Nárnia;9,78858E+12;1;"ficção cristã; literatura infanto-juvenil";LIJ-L673;;;;;;;;;;;;;;;;;;;;
E-100303;João Calvino no Brasil ou caminhos da providência;Valter Graciano Martins;;;2019;Monergismo;;;9,78857E+12;1;"biografia; predestinação; apologética; romanismo; livre-arbítrio";B-M386;;;;;;;;;;;;;;;;;;;;
E-100304;A sabedoria de Deus: um ano de devocionais diários em Provérbios;"Timothy Keller; Kathy Keller";;;2019;Vida Nova;;;9,78853E+12;1;"devocional; vida cristã; espiritualidade; sabedoria; ";VCE-K29;;;;;;;;;;;;;;;;;;;;
E-100305;A sabedoria de Deus: um ano de devocionais diários em Provérbios;"Timothy Keller; Kathy Keller";;;2019;Vida Nova;;;9,78853E+12;2;"devocional; vida cristã; espiritualidade; sabedoria; ";VCE-K29;;;;;;;;;;;;;;;;;;;;
E-100306;A sabedoria de Deus: um ano de devocionais diários em Provérbios;"Timothy Keller; Kathy Keller";;;2019;Vida Nova;;;9,78853E+12;3;"devocional; vida cristã; espiritualidade; sabedoria; ";VCE-K29;;;;;;;;;;;;;;;;;;;;
E-100307;Lições de um leito de hospital;John Piper;;;2017;Vida Nova;;;9,78853E+12;1;"doenças; vida cristã; sofrimento; enfermindade";VCE-P665;;;;;;;;;;;;;;;;;;;;
E-100308;Teologia Sistemática;Louis Berkhof;;4.ed. 2012;2021 (reimpr.);Cultura cristã;;;9,78858E+12;1;"doutrina; teologia sistemática";TS-B512;;;;;;;;;;;;;;;;;;;;
E-100309;Análise das Institutas de Calvino;Ford Lewis Battles;;;2022;Vida Nova;;;9,78656E+12;1;"Institutas; doutrina; teologia doutrinal; João Calvino";In-B336;;;;;;;;;;;;;;;;;;;;
E-100310;Oração: experimentando intimidade com Deus;Timothy Keller;;;2016;Vida Nova;;;9,78853E+12;1;"oração; vida cristã; espiritualidade; disciplina espiritual";VCE-K29;;;;;;;;;;;;;;;;;;;;
